{
  "run_id": "20260519-173709-local",
  "started_at": "2026-05-19T15:37:09.267334+00:00",
  "finished_at": "2026-05-19T15:37:52.039146+00:00",
  "targets": [
    {
      "id": "qyl",
      "name": "qyl",
      "path": "/Users/ancplua/RiderProjects/qyl",
      "solution": "qyl.slnx",
      "kind": "dotnet",
      "expected_build": true,
      "expected_tests": true,
      "coverage_required": true,
      "telemetry_required": true,
      "ground_truth_label": null,
      "ground_truth_source": "unset; do not use for correctness until filled"
    },
    {
      "id": "arqio",
      "name": "Arqio",
      "path": "/Users/ancplua/RiderProjects/Arqio",
      "solution": "Arqio.slnx",
      "kind": "dotnet",
      "expected_build": true,
      "expected_tests": true,
      "coverage_required": true,
      "telemetry_required": false,
      "ground_truth_label": null,
      "ground_truth_source": "unset; do not use for correctness until filled"
    },
    {
      "id": "semconv-testbed",
      "name": "semconv-testbed",
      "path": "/Users/ancplua/RiderProjects/semconv-testbed",
      "solution": "semconv-testbed.slnx",
      "kind": "dotnet",
      "expected_build": true,
      "expected_tests": true,
      "coverage_required": false,
      "telemetry_required": false,
      "ground_truth_label": null,
      "ground_truth_source": "unset; do not use for correctness until filled"
    },
    {
      "id": "otel-conventions-api",
      "name": "ANcpLua.OtelConventions.Api",
      "path": "/Users/ancplua/RiderProjects/ANcpLua.OtelConventions.Api",
      "solution": null,
      "kind": "node-or-dotnet-discover",
      "expected_build": true,
      "expected_tests": true,
      "coverage_required": false,
      "telemetry_required": false,
      "ground_truth_label": null,
      "ground_truth_source": "unset; do not use for correctness until filled"
    },
    {
      "id": "tourplanner-dotnet",
      "name": "TourPlanner",
      "path": "/Users/ancplua/RiderProjects/TourPlanner",
      "clone_url": "https://github.com/ANcpLua/TourPlanner",
      "kind": "dotnet-discover",
      "expected_build": true,
      "expected_tests": true,
      "coverage_required": true,
      "telemetry_required": false,
      "ground_truth_label": null,
      "ground_truth_source": "unset; do not use for correctness until filled"
    },
    {
      "id": "tourplanner-angular",
      "name": "TourPlanner-Angular",
      "path": "/Users/ancplua/RiderProjects/TourPlanner-Angular",
      "clone_url": "https://github.com/ANcpLua/TourPlanner-Angular",
      "kind": "node-angular-discover",
      "expected_build": true,
      "expected_tests": true,
      "coverage_required": true,
      "telemetry_required": false,
      "ground_truth_label": null,
      "ground_truth_source": "unset; do not use for correctness until filled"
    }
  ],
  "results": [
    {
      "target_id": "qyl",
      "target_name": "qyl",
      "run_id": "20260519-173709-local",
      "iteration": 1,
      "started_at": "2026-05-19T15:37:09.267522+00:00",
      "finished_at": "2026-05-19T15:37:32.891768+00:00",
      "git": {
        "commit": "c2ab2116dd35298e50a123c2152a5ec72a928a21",
        "status_short": "D eng/automation/CHANGELOG.md\n?? .agents/skills/rider/\n?? CHANGELOG.md\n?? eng/automation/arqio/\n?? eng/automation/semconv/\n?? eng/automation/thesis/\n?? reports/\n?? research/",
        "branch": "main"
      },
      "build": {
        "status": "passed",
        "exit_code": 0,
        "duration_seconds": 10.581,
        "log": "/Users/ancplua/RiderProjects/qyl/research/arqio/results/20260519-173709-local/qyl/iteration-1/dotnet-build.log"
      },
      "test": {
        "status": "failed",
        "exit_code": 2,
        "duration_seconds": 3.168,
        "log": "/Users/ancplua/RiderProjects/qyl/research/arqio/results/20260519-173709-local/qyl/iteration-1/dotnet-test.log"
      },
      "coverage": {
        "coverage_status": "unavailable",
        "reason": "coverage file not found: /Users/ancplua/RiderProjects/qyl/research/arqio/results/20260519-173709-local/qyl/iteration-1/coverage/TestResults/coverage.cobertura.xml",
        "generated_at": "2026-05-19T15:37:30.795666+00:00"
      },
      "telemetry": {
        "status": "unavailable",
        "docker_compose_config": {
          "status": "failed",
          "exit_code": 1,
          "duration_seconds": 0.346,
          "log": "/Users/ancplua/RiderProjects/qyl/research/arqio/results/20260519-173709-local/qyl/iteration-1/docker-compose-config.log"
        }
      },
      "classification": {
        "label": "service-oriented-or-distributed",
        "confidence": 0.72,
        "method": "deterministic repository-structure heuristic",
        "correctness_claim": "none; no ground truth label configured",
        "features": {
          "csproj_count": 23,
          "package_json_count": 10,
          "compose_file_count": 0,
          "metrics_xml_count": 0,
          "service_dir_count": 5,
          "src_project_dir_count": 11
        }
      },
      "logs": {
        "restore": "/Users/ancplua/RiderProjects/qyl/research/arqio/results/20260519-173709-local/qyl/iteration-1/dotnet-restore.log",
        "build": "/Users/ancplua/RiderProjects/qyl/research/arqio/results/20260519-173709-local/qyl/iteration-1/dotnet-build.log",
        "test": "/Users/ancplua/RiderProjects/qyl/research/arqio/results/20260519-173709-local/qyl/iteration-1/dotnet-test.log"
      }
    },
    {
      "target_id": "arqio",
      "target_name": "Arqio",
      "run_id": "20260519-173709-local",
      "iteration": 1,
      "started_at": "2026-05-19T15:37:32.892070+00:00",
      "finished_at": "2026-05-19T15:37:35.262516+00:00",
      "git": {
        "commit": "6e831bfad9464162a6987dee654fd93873a39953",
        "status_short": "",
        "branch": "main"
      },
      "build": {
        "status": "failed",
        "exit_code": 1,
        "duration_seconds": 0.396,
        "log": "/Users/ancplua/RiderProjects/qyl/research/arqio/results/20260519-173709-local/arqio/iteration-1/dotnet-build.log"
      },
      "test": {
        "status": "skipped",
        "reason": "build did not pass",
        "log": "/Users/ancplua/RiderProjects/qyl/research/arqio/results/20260519-173709-local/arqio/iteration-1/dotnet-test.log"
      },
      "coverage": {
        "coverage_status": "unavailable",
        "reason": "coverage file not found: /Users/ancplua/RiderProjects/qyl/research/arqio/results/20260519-173709-local/arqio/iteration-1/coverage/TestResults/coverage.cobertura.xml",
        "generated_at": "2026-05-19T15:37:35.082275+00:00"
      },
      "telemetry": {
        "status": "not_required"
      },
      "classification": {
        "label": "service-oriented-or-distributed",
        "confidence": 0.72,
        "method": "deterministic repository-structure heuristic",
        "correctness_claim": "none; no ground truth label configured",
        "features": {
          "csproj_count": 25,
          "package_json_count": 0,
          "compose_file_count": 1,
          "metrics_xml_count": 2,
          "service_dir_count": 0,
          "src_project_dir_count": 4
        }
      },
      "logs": {
        "restore": "/Users/ancplua/RiderProjects/qyl/research/arqio/results/20260519-173709-local/arqio/iteration-1/dotnet-restore.log",
        "build": "/Users/ancplua/RiderProjects/qyl/research/arqio/results/20260519-173709-local/arqio/iteration-1/dotnet-build.log",
        "test": "/Users/ancplua/RiderProjects/qyl/research/arqio/results/20260519-173709-local/arqio/iteration-1/dotnet-test.log"
      }
    },
    {
      "target_id": "semconv-testbed",
      "target_name": "semconv-testbed",
      "run_id": "20260519-173709-local",
      "iteration": 1,
      "started_at": "2026-05-19T15:37:35.263153+00:00",
      "finished_at": "2026-05-19T15:37:36.939563+00:00",
      "git": {
        "commit": "1a3094e7c2178ce3b83d09f785ec0a5bba84440e",
        "status_short": "",
        "branch": "main"
      },
      "build": {
        "status": "passed",
        "exit_code": 0,
        "duration_seconds": 0.24,
        "log": "/Users/ancplua/RiderProjects/qyl/research/arqio/results/20260519-173709-local/semconv-testbed/iteration-1/dotnet-build.log"
      },
      "test": {
        "status": "passed",
        "exit_code": 0,
        "duration_seconds": 1.097,
        "log": "/Users/ancplua/RiderProjects/qyl/research/arqio/results/20260519-173709-local/semconv-testbed/iteration-1/dotnet-test.log"
      },
      "coverage": {
        "coverage_status": "not_required"
      },
      "telemetry": {
        "status": "not_required"
      },
      "classification": {
        "label": "modular-monolith-or-multi-project",
        "confidence": 0.66,
        "method": "deterministic repository-structure heuristic",
        "correctness_claim": "none; no ground truth label configured",
        "features": {
          "csproj_count": 4,
          "package_json_count": 0,
          "compose_file_count": 0,
          "metrics_xml_count": 0,
          "service_dir_count": 0,
          "src_project_dir_count": 2
        }
      },
      "logs": {
        "restore": "/Users/ancplua/RiderProjects/qyl/research/arqio/results/20260519-173709-local/semconv-testbed/iteration-1/dotnet-restore.log",
        "build": "/Users/ancplua/RiderProjects/qyl/research/arqio/results/20260519-173709-local/semconv-testbed/iteration-1/dotnet-build.log",
        "test": "/Users/ancplua/RiderProjects/qyl/research/arqio/results/20260519-173709-local/semconv-testbed/iteration-1/dotnet-test.log"
      }
    },
    {
      "target_id": "otel-conventions-api",
      "target_name": "ANcpLua.OtelConventions.Api",
      "run_id": "20260519-173709-local",
      "iteration": 1,
      "started_at": "2026-05-19T15:37:36.939844+00:00",
      "finished_at": "2026-05-19T15:37:39.867715+00:00",
      "git": {
        "commit": "4a6708472821b50cd854cb2db8a2a462f09cbc60",
        "status_short": "",